[
  {
    "schema_version": "1.0.0",
    "run_id": "00000000-0000-4000-8000-000000000002",
    "identity_kind": "DATASET",
    "record_kind": "CALL_OBSERVATION",
    "trace_id": "T_11560863075",
    "span_id": "MSCallGraph/0d0/part-000.csv:row-1",
    "parent_span_id": null,
    "parent_relation": "UNKNOWN",
    "service_namespace": "alibaba-v2022",
    "service_name": "MS_71712",
    "service_instance_id": "MS_71712_POD_244",
    "operation_name": "xOuy6-80Vt",
    "span_kind": "UNKNOWN",
    "start_time_ns": null,
    "end_time_ns": null,
    "duration_ns": "2000000",
    "time_domain": "UNKNOWN",
    "timing_quality": "DURATION_ONLY",
    "status": {
      "code": "UNKNOWN",
      "message": null
    },
    "span_flags": null,
    "trace_state": null,
    "attributes": {},
    "resource": {
      "attributes": {},
      "schema_url": null
    },
    "scope": {
      "name": null,
      "version": null,
      "attributes": {},
      "schema_url": null
    },
    "events": [],
    "links": [],
    "dropped_counts": {
      "span_attributes": 0,
      "events": 0,
      "links": 0,
      "resource_attributes": 0,
      "scope_attributes": 0
    },
    "received_at_unix_ns": "1791936002000000000",
    "source": {
      "format": "alibaba_ms_call_graph_v2022",
      "adapter_version": "example-1",
      "record_key": "MSCallGraph/0d0/part-000.csv:row-1",
      "raw_reference": null,
      "details": {
        "traceid": "T_11560863075",
        "rpc_id": "0.1",
        "rpc_parent_path": "0",
        "um": "MS_58845",
        "uminstanceid": "MS_58845_POD_0",
        "dm": "MS_71712",
        "dminstanceid": "MS_71712_POD_244",
        "rpctype": "rpc",
        "timestamp_raw": "115352",
        "rt_raw": "2.0",
        "duration_unit_assumption": "milliseconds; verify selected release"
      }
    },
    "quality_flags": [
      "call_observation",
      "missing_interval",
      "unknown_error_status",
      "ambiguous_observation_side"
    ]
  }
]
