[
  {
    "schema_version": "1.0.0",
    "run_id": "00000000-0000-4000-8000-000000000001",
    "identity_kind": "OTEL",
    "record_kind": "SPAN",
    "trace_id": "11111111111111111111111111111111",
    "span_id": "0000000000000002",
    "parent_span_id": "0000000000000001",
    "parent_relation": "EXPLICIT",
    "service_namespace": "shop",
    "service_name": "payment",
    "service_instance_id": null,
    "operation_name": "authorize",
    "span_kind": "SERVER",
    "start_time_ns": "1791936000100000000",
    "end_time_ns": "1791936000800000000",
    "duration_ns": "700000000",
    "time_domain": "UNIX",
    "timing_quality": "MEASURED",
    "status": {
      "code": "ERROR",
      "message": "payment timeout"
    },
    "span_flags": 1,
    "trace_state": null,
    "attributes": {
      "large.counter": {
        "type": "int",
        "value": "9223372036854775807"
      },
      "custom.bytes": {
        "type": "bytes",
        "value": "AAEC"
      },
      "empty": {
        "type": "empty",
        "value": null
      },
      "mixed": {
        "type": "array",
        "value": [
          {
            "type": "string",
            "value": "x"
          },
          {
            "type": "bool",
            "value": true
          }
        ]
      }
    },
    "resource": {
      "attributes": {
        "service.name": {
          "type": "string",
          "value": "payment"
        },
        "service.namespace": {
          "type": "string",
          "value": "shop"
        }
      },
      "schema_url": null
    },
    "scope": {
      "name": "example.instrumentation",
      "version": "1.0.0",
      "attributes": {},
      "schema_url": null
    },
    "events": [
      {
        "name": "exception",
        "time_ns": "1791936000100000000",
        "attributes": {
          "exception.type": {
            "type": "string",
            "value": "TimeoutError"
          }
        },
        "dropped_attributes_count": 0
      }
    ],
    "links": [
      {
        "trace_id": "33333333333333333333333333333333",
        "span_id": "0000000000000004",
        "identity_kind": "OTEL",
        "attributes": {},
        "span_flags": 1,
        "trace_state": null,
        "dropped_attributes_count": 0
      }
    ],
    "dropped_counts": {
      "span_attributes": 0,
      "events": 0,
      "links": 0,
      "resource_attributes": 0,
      "scope_attributes": 0
    },
    "received_at_unix_ns": "1791936002000000000",
    "source": {
      "format": "otlp_json",
      "adapter_version": "example-1",
      "record_key": "0000000000000002",
      "raw_reference": null,
      "details": {}
    },
    "quality_flags": []
  }
]
